{"app_version":"0.4.0+7","format":"lyceum-export","format_version":"1.0","produced_at":"2026-10-23T08:15:30Z","producer":{"app":"lyceum","app_version":"0.4.0+7"},"schema_version":2,"tables":{"acts":[{"created_at":"2026-10-22T09:00:00.000Z","deleted_at":null,"id":"act-1","order_index":0,"part_id":"part-1","title":"Acto I","updated_at":"2026-10-22T09:00:00.000Z","work_id":"work-1"}],"app_preferences":[{"key":"home.layout","updated_at":"2026-10-22T09:00:00.000Z","value":"compact"}],"bible_events":[{"created_at":"2026-10-22T09:00:00.000Z","date_text":"1810–1812","deleted_at":null,"description":null,"id":"ev-1","notes":null,"order_index":0,"title":"Sitio de Cádiz","updated_at":"2026-10-22T09:00:00.000Z","work_id":"work-1"},{"created_at":"2026-10-22T09:00:00.000Z","date_text":"19 de marzo de 1812","deleted_at":null,"description":"The constitution is proclaimed.","id":"ev-2","notes":null,"order_index":1,"title":"Constitución de 1812","updated_at":"2026-10-22T09:00:00.000Z","work_id":"work-1"}],"captures":[{"content":"Inés de Lara cruzó el puerto de Cádiz al amanecer, con el cuaderno de mapas bajo el brazo y la certeza de que nadie —ni siquiera su hermano— sabría leer las anotaciones en el margen. «La costa no está donde dicen las cartas», escribió.\nShe crossed the harbour at dawn, the map book under her arm, sure that no one would read the notes in the margin: \"the coast is not where the charts say it is\" \\ C:\\archivo\\1812.\tAño, señal, pingüino, 𝄞.","converted_to_entity_id":null,"converted_to_entity_type":null,"created_at":"2026-10-22T09:00:00.000Z","deleted_at":null,"id":"cap-1","source_url":null,"status":"active","type_hint":"note","updated_at":"2026-10-22T09:00:00.000Z","work_id":"work-1"},{"content":null,"converted_to_entity_id":null,"converted_to_entity_type":null,"created_at":"2026-10-22T09:00:00.000Z","deleted_at":null,"id":"cap-2","source_url":null,"status":"active","type_hint":"photo","updated_at":"2026-10-22T09:00:00.000Z","work_id":"work-1"},{"content":"Nota de voz / voice note","converted_to_entity_id":null,"converted_to_entity_type":null,"created_at":"2026-10-22T09:00:00.000Z","deleted_at":"2026-10-22T10:30:00.000Z","id":"cap-3","source_url":null,"status":"archived","type_hint":"voice","updated_at":"2026-10-22T09:00:00.000Z","work_id":null}],"chapters":[{"act_id":"act-1","chapter_number":1,"created_at":"2026-10-22T09:00:00.000Z","deleted_at":null,"id":"ch-1","notes":null,"order_index":0,"part_id":"part-1","pov":"Inés","status":"drafted","summary":"Inés de Lara cruzó el puerto de Cádiz al amanecer, con el cuaderno de mapas bajo el brazo y la certeza de que nadie —ni siquiera su hermano— sabría leer las anotaciones en el margen. «La costa no está donde dicen las cartas», escribió.\nShe crossed the harbour at dawn, the map book under her arm, sure that no one would read the notes in the margin: \"the coast is not where the charts say it is\" \\ C:\\archivo\\1812.\tAño, señal, pingüino, 𝄞.","title":"El puerto","updated_at":"2026-10-22T09:00:00.000Z","word_count":4210,"work_id":"work-1"},{"act_id":null,"chapter_number":2,"created_at":"2026-10-22T09:00:00.000Z","deleted_at":null,"id":"ch-2","notes":null,"order_index":1,"part_id":null,"pov":null,"status":"concept","summary":null,"title":"Sin acto","updated_at":"2026-10-22T09:00:00.000Z","word_count":null,"work_id":"work-1"}],"character_chapters":[{"appearance_type":"pov","chapter_id":"ch-1","character_id":"char-1"}],"character_events":[{"character_id":"char-1","event_id":"ev-1","role":"witness"},{"character_id":"char-1","event_id":"ev-2","role":null},{"character_id":"char-3","event_id":"ev-1","role":null}],"characters":[{"age":"34","backstory":"Inés de Lara cruzó el puerto de Cádiz al amanecer, con el cuaderno de mapas bajo el brazo y la certeza de que nadie —ni siquiera su hermano— sabría leer las anotaciones en el margen. «La costa no está donde dicen las cartas», escribió.\nShe crossed the harbour at dawn, the map book under her arm, sure that no one would read the notes in the margin: \"the coast is not where the charts say it is\" \\ C:\\archivo\\1812.\tAño, señal, pingüino, 𝄞.","created_at":"2026-10-22T09:00:00.000Z","deleted_at":null,"description":"Cartógrafa / cartographer","id":"char-1","name":"Inés de Lara","notes":null,"occupation":"cartógrafa","role":"protagonist","updated_at":"2026-10-22T09:00:00.000Z","work_id":"work-1"},{"age":null,"backstory":null,"created_at":"2026-10-22T09:00:00.000Z","deleted_at":"2026-10-22T10:30:00.000Z","description":null,"id":"char-2","name":"Tomás (borrado)","notes":null,"occupation":null,"role":"secondary","updated_at":"2026-10-22T09:00:00.000Z","work_id":"work-1"},{"age":null,"backstory":null,"created_at":"2026-10-22T09:00:00.000Z","deleted_at":null,"description":null,"id":"char-3","name":"Mateo de Lara","notes":"Hermano / brother","occupation":null,"role":"antagonist","updated_at":"2026-10-22T09:00:00.000Z","work_id":"work-1"}],"collection_items":[{"added_at":"2026-10-22T09:00:00.000Z","collection_id":"col-1","entity_id":"char-1","entity_table":"characters"},{"added_at":"2026-10-22T09:00:00.000Z","collection_id":"col-1","entity_id":"exp-1","entity_table":"experts"}],"collections":[{"created_at":"2026-10-22T09:00:00.000Z","deleted_at":null,"description":"Inés de Lara cruzó el puerto de Cádiz al amanecer, con el cuaderno de mapas bajo el brazo y la certeza de que nadie —ni siquiera su hermano— sabría leer las anotaciones en el margen. «La costa no está donde dicen las cartas», escribió.\nShe crossed the harbour at dawn, the map book under her arm, sure that no one would read the notes in the margin: \"the coast is not where the charts say it is\" \\ C:\\archivo\\1812.\tAño, señal, pingüino, 𝄞.","id":"col-1","name":"Escenas del puerto / Harbour scenes","updated_at":"2026-10-22T09:00:00.000Z","work_id":"work-1"},{"created_at":"2026-10-22T09:00:00.000Z","deleted_at":"2026-10-22T10:30:00.000Z","description":null,"id":"col-2","name":"Descartes","updated_at":"2026-10-22T09:00:00.000Z","work_id":null}],"custom_entities":[{"created_at":"2026-10-22T09:00:00.000Z","data":"{\"origen\":\"Lisboa\"}","deleted_at":null,"id":"ce-1","name":"Astrolabio","notes":null,"type_id":"cet-1","updated_at":"2026-10-22T09:00:00.000Z","work_id":"work-1"}],"custom_entity_types":[{"color":null,"created_at":"2026-10-22T09:00:00.000Z","deleted_at":null,"fields_definition":"[{\"key\":\"origen\",\"type\":\"text\"}]","icon":"compass","id":"cet-1","name":"Artefacto","slug":"artefacto","updated_at":"2026-10-22T09:00:00.000Z","work_id":"work-1"}],"entity_images":[{"created_at":"2026-10-22T09:00:00.000Z","deleted_at":null,"entity_id":"char-1","entity_type":"character","file_path":"images/char-1/portrait.jpg","id":"img-1","is_primary":1,"sort_order":0,"updated_at":"2026-10-22T09:00:00.000Z"}],"entity_media":[{"content_hash":"fc892e954c07bdda3bb015c1220d535adf63d38bfb9f95ee4e52d22ae32cd6b2","created_at":"2026-10-22T09:00:00.000Z","deleted_at":null,"display_order":0,"entity_id":"cap-2","entity_table":"captures","id":"em-1","role":null,"updated_at":"2026-10-22T09:00:00.000Z"},{"content_hash":"fbbc27238b7127eaa2b0022743a81404ca38ef7935405b388d6ace2e451753cb","created_at":"2026-10-22T09:00:00.000Z","deleted_at":null,"display_order":0,"entity_id":"cap-3","entity_table":"captures","id":"em-2","role":null,"updated_at":"2026-10-22T09:00:00.000Z"},{"content_hash":"b87470ff2b2992c65aa04bcfaba7a0d23d570edfdae0d2f0e91aac247b47c162","created_at":"2026-10-22T09:00:00.000Z","deleted_at":null,"display_order":0,"entity_id":"char-1","entity_table":"characters","id":"em-3","role":"portrait","updated_at":"2026-10-22T09:00:00.000Z"}],"entity_tags":[{"added_at":"2026-10-22T09:00:00.000Z","entity_id":"char-1","entity_table":"characters","tag_id":"tag-1"},{"added_at":"2026-10-22T09:00:00.000Z","entity_id":"sub-1","entity_table":"submissions","tag_id":"tag-2"}],"experts":[{"created_at":"2026-10-22T09:00:00.000Z","deleted_at":null,"email":null,"expertise":"Cartografía naval","id":"exp-1","institution":"Archivo Histórico","name":"Archivera del puerto","notes":null,"phone":null,"title":"Dra.","updated_at":"2026-10-22T09:00:00.000Z","website":null}],"figure_relationships":[{"created_at":"2026-10-22T09:00:00.000Z","deleted_at":null,"description":null,"figure_id_a":"fig-1","figure_id_b":"fig-2","id":"frel-1","relationship_type":"colleague","updated_at":"2026-10-22T09:00:00.000Z"}],"group_members":[{"character_id":"char-1","group_id":"grp-1"},{"character_id":"char-3","group_id":"grp-1"}],"groups":[{"created_at":"2026-10-22T09:00:00.000Z","deleted_at":null,"description":null,"group_type":"family","id":"grp-1","name":"Familia Lara","updated_at":"2026-10-22T09:00:00.000Z","work_id":"work-1"}],"historical_figures":[{"birth_date":"1732","created_at":"2026-10-22T09:00:00.000Z","death_date":"1795","deleted_at":null,"description":null,"id":"fig-1","name":"Vicente Tofiño","nationality":"española","notes":null,"updated_at":"2026-10-22T09:00:00.000Z"},{"birth_date":"1745","created_at":"2026-10-22T09:00:00.000Z","death_date":"1812","deleted_at":null,"description":null,"id":"fig-2","name":"José de Mazarredo","nationality":null,"notes":null,"updated_at":"2026-10-22T09:00:00.000Z"}],"institutions":[{"created_at":"2026-10-22T09:00:00.000Z","deleted_at":null,"id":"inst-1","institution_type":"observatory","location":"San Fernando","name":"Real Observatorio de la Armada","notes":null,"updated_at":"2026-10-22T09:00:00.000Z","website":null}],"location_events":[{"event_id":"ev-1","location_id":"loc-1"}],"locations":[{"created_at":"2026-10-22T09:00:00.000Z","deleted_at":null,"description":"Inés de Lara cruzó el puerto de Cádiz al amanecer, con el cuaderno de mapas bajo el brazo y la certeza de que nadie —ni siquiera su hermano— sabría leer las anotaciones en el margen. «La costa no está donde dicen las cartas», escribió.\nShe crossed the harbour at dawn, the map book under her arm, sure that no one would read the notes in the margin: \"the coast is not where the charts say it is\" \\ C:\\archivo\\1812.\tAño,